Authors,Author Ids,Title,Year,Source title,Volume,Issue,Art. No.,Page start,Page end,Page count,Cited by,Link,Document Type,Source,EID
"Robert J.J., Joshua M.D.","57196653665;6506148874;","Informing preservation of multifunctional agriculture when primary research is unavailable: An application of meta-analysis",2009,"American Journal of Agricultural Economics","91","5",,"1353","1359",,10,"https://www.scopus.com/inward/record.uri?eid=2-s2.0-74549212733&doi=10.1111%2fj.1467-8276.2009.01347.x&partnerID=40&md5=b831c832b89c5a0e7a2e1ceea5a2dcf1",Article,Scopus,2-s2.0-74549212733
"Czajkowski M., Buszko-Briggs M., Hanley N.","26655387000;8270962800;7005750378;","Valuing changes in forest biodiversity",2009,"Ecological Economics","68","12",,"2910","2917",,44,"https://www.scopus.com/inward/record.uri?eid=2-s2.0-69449083980&doi=10.1016%2fj.ecolecon.2009.06.016&partnerID=40&md5=079a58228bb556df48266c3665e2aa1f",Article,Scopus,2-s2.0-69449083980
"Colombo S., Angus A., Morris J., Parsons D.J., Brawn M., Stacey K., Hanley N.","56268441100;8086604300;15751289900;24353424800;26867571700;57198197500;7005750378;","A comparison of citizen and ""expert"" preferences using an attribute-based approach to choice",2009,"Ecological Economics","68","11",,"2834","2841",,22,"https://www.scopus.com/inward/record.uri?eid=2-s2.0-68249152359&doi=10.1016%2fj.ecolecon.2009.06.001&partnerID=40&md5=79474f59ec9830410361c451872955cf",Article,Scopus,2-s2.0-68249152359
"Collins J.P., Vossler C.A.","35209466700;6602985643;","Incentive compatibility tests of choice experiment value elicitation questions",2009,"Journal of Environmental Economics and Management","58","2",,"226","235",,27,"https://www.scopus.com/inward/record.uri?eid=2-s2.0-68049095243&doi=10.1016%2fj.jeem.2009.04.004&partnerID=40&md5=af35a641b815cf3104f905ba594b7e82",Article,Scopus,2-s2.0-68049095243
"Bateman I.J., Day B.H., Jones A.P., Jude S.","7005934781;7203035599;7407101741;55964716600;","Reducing gain-loss asymmetry: A virtual reality choice experiment valuing land use change",2009,"Journal of Environmental Economics and Management","58","1",,"106","118",,94,"https://www.scopus.com/inward/record.uri?eid=2-s2.0-67349288075&doi=10.1016%2fj.jeem.2008.05.003&partnerID=40&md5=e97f27000e1b75069cf3fba607a54137",Article,Scopus,2-s2.0-67349288075
"Gao Z., Schroeder T.C.","24075689500;7202054130;","Effects of label information on consumer willingness-to-pay for food attributes",2009,"American Journal of Agricultural Economics","91","3",,"795","809",,91,"https://www.scopus.com/inward/record.uri?eid=2-s2.0-65249172852&doi=10.1111%2fj.1467-8276.2009.01259.x&partnerID=40&md5=b5cf57bc437b3dd62dd204fa6a247292",Article,Scopus,2-s2.0-65249172852
"Corrigan J.R., Depositario D.P.T., Nayga Jr. R.M., Wu X., Laude T.P.","8330457400;25924801800;7003839193;56129604800;25925078200;","Comparing open-ended choice experiments and experimental auctions: An application to golden rice",2009,"American Journal of Agricultural Economics","91","3",,"837","853",,55,"https://www.scopus.com/inward/record.uri?eid=2-s2.0-67049114263&doi=10.1111%2fj.1467-8276.2009.01267.x&partnerID=40&md5=50ac62c647e066105c4daa2d8cb11804",Article,Scopus,2-s2.0-67049114263
"Arunachalam B., Henneberry S.R., Lusk J.L., Norwood F.B.","26646277500;6602789118;7004997535;8705689600;","An empirical investigation into the excessive-choice effect",2009,"American Journal of Agricultural Economics","91","3",,"810","825",,26,"https://www.scopus.com/inward/record.uri?eid=2-s2.0-67049162351&doi=10.1111%2fj.1467-8276.2009.01260.x&partnerID=40&md5=94e01d09d983ffa125f925e479758491",Article,Scopus,2-s2.0-67049162351
"Araña J.E., León C.J.","7005207170;7101886256;","Understanding the use of non-compensatory decision rules in discrete choice experiments: The role of emotions",2009,"Ecological Economics","68","8-9",,"2316","2326",,32,"https://www.scopus.com/inward/record.uri?eid=2-s2.0-65649116942&doi=10.1016%2fj.ecolecon.2009.03.003&partnerID=40&md5=6e6edf91b5e7c81f520e30157636b098",Article,Scopus,2-s2.0-65649116942
"Hoyos D., Mariel P., Fernández-Macho J.","26537598700;6603591242;23027490600;","The influence of cultural identity on the WTP to protect natural resources: Some empirical evidence",2009,"Ecological Economics","68","8-9",,"2372","2381",,46,"https://www.scopus.com/inward/record.uri?eid=2-s2.0-65649088287&doi=10.1016%2fj.ecolecon.2009.03.015&partnerID=40&md5=3cf0ba365be32a1b5b3092e1be0cd02e",Article,Scopus,2-s2.0-65649088287
"Johnston R.J., Duke J.M.","7403679025;7102496030;","Willingness to pay for land preservation across states and jurisdictional scale: Implications for benefit transfer",2009,"Land Economics","85","2",,"217","237",,49,"https://www.scopus.com/inward/record.uri?eid=2-s2.0-66549126400&doi=10.3368%2fle.85.2.217&partnerID=40&md5=2dab50bec80eb4315d102e4cac96f031",Article,Scopus,2-s2.0-66549126400
"Fenichel E.P., Lupi F., Hoehn J.P., Kaplowitz M.D.","9335127600;6701734845;7005649244;7003313955;","Split-sample tests of ""no opinion"" responses in an attribute-based choice model",2009,"Land Economics","85","2",,"348","362",,18,"https://www.scopus.com/inward/record.uri?eid=2-s2.0-66549112093&doi=10.3368%2fle.85.2.348&partnerID=40&md5=2e8a4aac160205aa62795e4b3396d098",Article,Scopus,2-s2.0-66549112093
"Masclet D., Colombier N., Denant-Boemont L., Lohéac Y.","18233818900;24491496400;6506858602;11639360700;","Group and individual risk preferences: A lottery-choice experiment with self-employed and salaried workers",2009,"Journal of Economic Behavior and Organization","70","3",,"470","484",,62,"https://www.scopus.com/inward/record.uri?eid=2-s2.0-84859754442&doi=10.1016%2fj.jebo.2007.11.002&partnerID=40&md5=9e75ab6cd41509bf76d58178fb491464",Article,Scopus,2-s2.0-84859754442
"Bosworth R., Cameron T.A., DeShazo J.R.","16549271500;26643636100;6602870758;","Demand for environmental policies to improve health: Evaluating community-level policy scenarios",2009,"Journal of Environmental Economics and Management","57","3",,"293","308",,27,"https://www.scopus.com/inward/record.uri?eid=2-s2.0-64049100950&doi=10.1016%2fj.jeem.2008.07.009&partnerID=40&md5=b46b36e714671f8fb44269df6ae08742",Article,Scopus,2-s2.0-64049100950
"Aalbers R., van der Heijden E., Potters J., van Soest D., Vollebergh H.","16404180900;56243798600;56274822500;6701743982;6506813005;","Technology adoption subsidies: An experiment with managers",2009,"Energy Economics","31","3",,"431","442",,10,"https://www.scopus.com/inward/record.uri?eid=2-s2.0-62949208665&doi=10.1016%2fj.eneco.2008.12.002&partnerID=40&md5=b1ce2391e742a59cae0b91671c49c4b2",Article,Scopus,2-s2.0-62949208665
"Chang J.B., Lusk J.L., Norwood B.F.","57199040166;7004997535;8705689600;","How closely do hypothetical surveys and laboratory experiments predict field behavior?",2009,"American Journal of Agricultural Economics","91","2",,"518","534",,101,"https://www.scopus.com/inward/record.uri?eid=2-s2.0-64649096117&doi=10.1111%2fj.1467-8276.2008.01242.x&partnerID=40&md5=4dda66da23a9439d5157f917d64a9b82",Article,Scopus,2-s2.0-64649096117
"Balcombe K., Chalak A., Fraser I.","6701753683;24504470400;55753411600;","Model selection for the mixed logit with Bayesian estimation",2009,"Journal of Environmental Economics and Management","57","2",,"226","237",,56,"https://www.scopus.com/inward/record.uri?eid=2-s2.0-60449112786&doi=10.1016%2fj.jeem.2008.06.001&partnerID=40&md5=88a80c461e8e0de8ad87f5912b9bb5d6",Article,Scopus,2-s2.0-60449112786
"Álvarez-Farizo B., Gil J.M., Howard B.J.","6506098810;14063394800;7202678474;","Impacts from restoration strategies: Assessment through valuation workshops",2009,"Ecological Economics","68","3",,"787","797",,15,"https://www.scopus.com/inward/record.uri?eid=2-s2.0-57149123292&doi=10.1016%2fj.ecolecon.2008.06.012&partnerID=40&md5=09f993daf07d35fcb6d054ecfb070eb8",Article,Scopus,2-s2.0-57149123292
"Olsen S.B.","20535258800;","Choosing Between Internet and Mail Survey Modes for Choice Experiment Surveys Considering Non-Market Goods",2009,"Environmental and Resource Economics","44","4",,"591","610",,103,"https://www.scopus.com/inward/record.uri?eid=2-s2.0-72249118608&doi=10.1007%2fs10640-009-9303-7&partnerID=40&md5=49efd9f8b90205f35282b1619d659726",Article,Scopus,2-s2.0-72249118608
"Meyerhoff J., Liebe U.","12784168600;23982874600;","Status quo effect in choice experiments: Empirical evidence on attitudes and choice task complexity",2009,"Land Economics","85","3",,"515","528",,65,"https://www.scopus.com/inward/record.uri?eid=2-s2.0-70350339709&doi=10.3368%2fle.85.3.515&partnerID=40&md5=1fff7a8273a33eadb87a1ff8024a6422",Article,Scopus,2-s2.0-70350339709
"Kataria M.","26648777400;","Willingness to pay for environmental improvements in hydropower regulated rivers",2009,"Energy Economics","31","1",,"69","76",,35,"https://www.scopus.com/inward/record.uri?eid=2-s2.0-56949090168&doi=10.1016%2fj.eneco.2008.07.005&partnerID=40&md5=ffeb61155fdabdb6fe49020261c1aaa9",Article,Scopus,2-s2.0-56949090168
"Zander K.K., Drucker A.G.","23502639000;14037196500;","Conserving what's important: Using choice model scenarios to value local cattle breeds in East Africa",2008,"Ecological Economics","68","1-2",,"34","45",,39,"https://www.scopus.com/inward/record.uri?eid=2-s2.0-53649091748&doi=10.1016%2fj.ecolecon.2008.01.023&partnerID=40&md5=e35b2a4df172880d1ab514df0a25669b",Article,Scopus,2-s2.0-53649091748
"Ladenburg J., Olsen S.B.","16310323400;20535258800;","Gender-specific starting point bias in choice experiments: Evidence from an empirical study",2008,"Journal of Environmental Economics and Management","56","3",,"275","285",,51,"https://www.scopus.com/inward/record.uri?eid=2-s2.0-56549087229&doi=10.1016%2fj.jeem.2008.01.004&partnerID=40&md5=4c37b115efd3d9ca370a05d956b93d98",Article,Scopus,2-s2.0-56549087229
"Travisi C.M., Nijkamp P.","11141310800;7102958684;","Valuing environmental and health risk in agriculture: A choice experiment approach to pesticides in Italy",2008,"Ecological Economics","67","4",,"598","607",,45,"https://www.scopus.com/inward/record.uri?eid=2-s2.0-52049103557&doi=10.1016%2fj.ecolecon.2008.01.011&partnerID=40&md5=cdc7a6014ff4497cb60733392d15d39f",Article,Scopus,2-s2.0-52049103557
"Casey J.F., Kahn J.R., Rivas A.A.F.","9045024900;7402544541;56375719200;","Willingness to accept compensation for the environmental risks of oil transport on the Amazon: A choice modeling experiment",2008,"Ecological Economics","67","4",,"552","559",,20,"https://www.scopus.com/inward/record.uri?eid=2-s2.0-52049092532&doi=10.1016%2fj.ecolecon.2008.01.006&partnerID=40&md5=2dc81c37debafaea55356763547ee4ef",Article,Scopus,2-s2.0-52049092532
"Longo A., Markandya A., Petrucci M.","14630752700;56349420200;23480487100;","The internalization of externalities in the production of electricity: Willingness to pay for the attributes of a policy for renewable energy",2008,"Ecological Economics","67","1",,"140","152",,147,"https://www.scopus.com/inward/record.uri?eid=2-s2.0-48549090137&doi=10.1016%2fj.ecolecon.2007.12.006&partnerID=40&md5=4b9afe67dc99cb34e329ae7864db3678",Article,Scopus,2-s2.0-48549090137
"Caparrós A., Oviedo J.L., Campos P.","55581674300;16029644800;7005168290;","Would you choose your preferred option? Comparing choice and recoded ranking experiments",2008,"American Journal of Agricultural Economics","90","3",,"843","855",,28,"https://www.scopus.com/inward/record.uri?eid=2-s2.0-45449118730&doi=10.1111%2fj.1467-8276.2008.01137.x&partnerID=40&md5=e3f662ff91debec9b6c38f75f95ecc41",Article,Scopus,2-s2.0-45449118730
"Carlsson F., Martinsson P.","7006565467;7003959490;","How much is too much? An investigation of the effect of the number of choice sets, context dependence and the choice of bid vectors in choice experiments",2008,"Environmental and Resource Economics","40","2",,"165","176",,40,"https://www.scopus.com/inward/record.uri?eid=2-s2.0-43849086990&doi=10.1007%2fs10640-007-9146-z&partnerID=40&md5=7980db61d80fa7d060fd9e72c9d0e84e",Article,Scopus,2-s2.0-43849086990
"Roessler R., Drucker A.G., Scarpa R., Markemann A., Lemke U., Thuy L.T., Valle Zárate A.","24177108000;14037196500;7101679887;24177255200;14037707200;7004021769;6603118823;","Using choice experiments to assess smallholder farmers' preferences for pig breeding traits in different production systems in North-West Vietnam",2008,"Ecological Economics","66","1",,"184","192",,52,"https://www.scopus.com/inward/record.uri?eid=2-s2.0-43449106490&doi=10.1016%2fj.ecolecon.2007.08.023&partnerID=40&md5=7756d8e62046c8e650cb45471ce26d54",Article,Scopus,2-s2.0-43449106490
"Carlsson F., Martinsson P.","7006565467;7003959490;","Does it matter when a power outage occurs? - A choice experiment study on the willingness to pay to avoid power outages",2008,"Energy Economics","30","3",,"1232","1245",,64,"https://www.scopus.com/inward/record.uri?eid=2-s2.0-39749179769&doi=10.1016%2fj.eneco.2007.04.001&partnerID=40&md5=561f60cfbab30dbf51fdff1a51518192",Article,Scopus,2-s2.0-39749179769
"Bergmann A., Colombo S., Hanley N.","23975807600;56268441100;7005750378;","Rural versus urban preferences for renewable energy developments",2008,"Ecological Economics","65","3",,"616","625",,94,"https://www.scopus.com/inward/record.uri?eid=2-s2.0-40749102499&doi=10.1016%2fj.ecolecon.2007.08.011&partnerID=40&md5=8e48d9e5dc20b492e45672d5cf83716b",Article,Scopus,2-s2.0-40749102499
"Schläpfer F., Schmitt M., Roschewitz A.","57203790434;56269706700;23976712800;","Competitive politics, simplified heuristics, and preferences for public goods",2008,"Ecological Economics","65","3",,"574","589",,14,"https://www.scopus.com/inward/record.uri?eid=2-s2.0-40749094442&doi=10.1016%2fj.ecolecon.2007.08.008&partnerID=40&md5=abe9d953ff7616cae47ee11b48365a44",Article,Scopus,2-s2.0-40749094442
"Shapansky B., Adamowicz W.L., Boxall P.C.","23976527300;7003604078;26540876200;","Assessing information provision and respondent involvement effects on preferences",2008,"Ecological Economics","65","3",,"626","635",,14,"https://www.scopus.com/inward/record.uri?eid=2-s2.0-40749154860&doi=10.1016%2fj.ecolecon.2007.08.012&partnerID=40&md5=267432fc8db821b50568f5e41570887a",Article,Scopus,2-s2.0-40749154860
"Meyerhoff J., Liebe U.","12784168600;23982874600;","Do protest responses to a contingent valuation question and a choice experiment differ?",2008,"Environmental and Resource Economics","39","4",,"433","446",,49,"https://www.scopus.com/inward/record.uri?eid=2-s2.0-41049084281&doi=10.1007%2fs10640-007-9134-3&partnerID=40&md5=0191c2c6431771752e8cecf0d3c841c1",Article,Scopus,2-s2.0-41049084281
"Barkmann J., Glenk K., Keil A., Leemhuis C., Dietrich N., Gerold G., Marggraf R.","57108781500;16244931900;8561968800;13402991200;23388195700;6602703924;6507044098;","Confronting unfamiliarity with ecosystem functions: The case for an ecosystem service approach to environmental valuation with stated preference methods",2008,"Ecological Economics","65","1",,"48","62",,84,"https://www.scopus.com/inward/record.uri?eid=2-s2.0-39149096613&doi=10.1016%2fj.ecolecon.2007.12.002&partnerID=40&md5=e5b8439553df9ce2115f49174cd9713c",Article,Scopus,2-s2.0-39149096613
"Banfi S., Farsi M., Filippini M., Jakob M.","23093217600;8521880800;7004549654;7005489840;","Willingness to pay for energy-saving measures in residential buildings",2008,"Energy Economics","30","2",,"503","516",,167,"https://www.scopus.com/inward/record.uri?eid=2-s2.0-37349052126&doi=10.1016%2fj.eneco.2006.06.001&partnerID=40&md5=c94f4f975c1ae348334c23c95a99671c",Article,Scopus,2-s2.0-37349052126
"Carlsson F., Kataria M.","7006565467;26648777400;","Assessing management options for weed control with demanders and non-demanders in a choice experiment",2008,"Land Economics","84","3",,"517","528",,11,"https://www.scopus.com/inward/record.uri?eid=2-s2.0-48749092224&doi=10.3368%2fle.84.3.517&partnerID=40&md5=3211f7c0ea36ed6465342016bcfe8007",Article,Scopus,2-s2.0-48749092224
"Campbell D., Hutchinson W.G., Scarpa R.","56857858800;7006497149;7101679887;","Incorporating discontinuous preferences into the analysis of discrete choice experiments",2008,"Environmental and Resource Economics","41","3",,"401","417",,92,"https://www.scopus.com/inward/record.uri?eid=2-s2.0-52949148191&doi=10.1007%2fs10640-008-9198-8&partnerID=40&md5=989b36f346095c72d5419011968b209a",Article,Scopus,2-s2.0-52949148191
"Colombo S., Hanley N.","56268441100;7005750378;","How can we reduce the errors from benefits transfer? An investigation using the choice experiment method",2008,"Land Economics","84","1",,"128","147",,35,"https://www.scopus.com/inward/record.uri?eid=2-s2.0-41449117247&doi=10.3368%2fle.84.1.128&partnerID=40&md5=abdd244a9f2621edf21b9972bd028d72",Article,Scopus,2-s2.0-41449117247
"Mansfield C., Phaneuf D.J., Johnson F.R., Yang J.-C., Beach R.","7102568660;35567283400;55046773300;8284443100;15838564100;","Preferences for public lands management under competing uses: The case of Yellowstone National Park",2008,"Land Economics","84","2",,"282","305",,17,"https://www.scopus.com/inward/record.uri?eid=2-s2.0-44649094045&doi=10.3368%2fle.84.2.282&partnerID=40&md5=2c8745bbeea72e527dc653d51dcc1237",Article,Scopus,2-s2.0-44649094045
"Bateman I.J., Munro A., Poe G.L.","7005934781;35121849800;7003965603;","Decoy effects in choice experiments and contingent valuation: Asymmetric dominance",2008,"Land Economics","84","1",,"115","127",,32,"https://www.scopus.com/inward/record.uri?eid=2-s2.0-41449083066&doi=10.3368%2fle.84.1.115&partnerID=40&md5=782cd521513259a352c8176296c0bd44",Article,Scopus,2-s2.0-41449083066
"Johnston R.J.","7403679025;","Choice experiments, site similarity and benefits transfer",2007,"Environmental and Resource Economics","38","3",,"331","351",,38,"https://www.scopus.com/inward/record.uri?eid=2-s2.0-35148884368&doi=10.1007%2fs10640-006-9073-4&partnerID=40&md5=f5d38f399052115e755786016b9d1ba2",Article,Scopus,2-s2.0-35148884368
"Ouma E., Abdulai A., Drucker A.","22136234300;6603916682;14037196500;","Measuring heterogeneous preferences for cattle traits among cattle-keeping households in East Africa",2007,"American Journal of Agricultural Economics","89","4",,"1005","1019",,71,"https://www.scopus.com/inward/record.uri?eid=2-s2.0-34848851057&doi=10.1111%2fj.1467-8276.2007.01022.x&partnerID=40&md5=ad94f800851a43f5eabc1f4a84f22c63",Article,Scopus,2-s2.0-34848851057
"Johnston R.J., Duke J.M.","7403679025;7102496030;","Willingness to pay for agricultural land preservation and policy process attributes: Does the method matter?",2007,"American Journal of Agricultural Economics","89","4",,"1098","1115",,65,"https://www.scopus.com/inward/record.uri?eid=2-s2.0-34848813192&doi=10.1111%2fj.1467-8276.2007.01029.x&partnerID=40&md5=5cd114d35906b4977ae6adade0486ab0",Article,Scopus,2-s2.0-34848813192
"Moran D., McVittie A., Allcroft D.J., Elston D.A.","57196944257;12797728400;6603239116;7103398985;","Quantifying public preferences for agri-environmental policy in Scotland: A comparison of methods",2007,"Ecological Economics","63","1",,"42","53",,47,"https://www.scopus.com/inward/record.uri?eid=2-s2.0-34249715204&doi=10.1016%2fj.ecolecon.2006.09.018&partnerID=40&md5=cec2d2e1399b33793b67d22a724408c9",Article,Scopus,2-s2.0-34249715204
"Ferrini S., Scarpa R.","16401152200;7101679887;","Designs with a priori information for nonmarket valuation with choice experiments: A Monte Carlo study",2007,"Journal of Environmental Economics and Management","53","3",,"342","363",,233,"https://www.scopus.com/inward/record.uri?eid=2-s2.0-34249750510&doi=10.1016%2fj.jeem.2006.10.007&partnerID=40&md5=8d9b51b641fa5947b6636336032d1cf7",Article,Scopus,2-s2.0-34249750510
"Colombo S., Calatrava-Requena J., Hanley N.","56268441100;8317958300;7005750378;","Testing choice experiment for benefit transfer with preference heterogeneity",2007,"American Journal of Agricultural Economics","89","1",,"135","151",,43,"https://www.scopus.com/inward/record.uri?eid=2-s2.0-33846923885&doi=10.1111%2fj.1467-8276.2007.00968.x&partnerID=40&md5=f078d0b4b7802e9129eeb081831d169d",Article,Scopus,2-s2.0-33846923885
"Carlsson F., Frykblom P., Lagerkvist C.J.","7006565467;6507177093;8515509000;","Consumer benefits of labels and bans on GM foods - Choice experiments with Swedish consumers",2007,"American Journal of Agricultural Economics","89","1",,"152","161",,72,"https://www.scopus.com/inward/record.uri?eid=2-s2.0-33846934532&doi=10.1111%2fj.1467-8276.2007.00969.x&partnerID=40&md5=b1c54d4fd6c640bbcb17606b6bbe515a",Article,Scopus,2-s2.0-33846934532
"Álvarez-Farizo B., Hanley N., Barberán R., Lázaro A.","6506098810;7005750378;6507978240;7005716324;","Choice modeling at the ""market stall"": Individual versus collective interest in environmental valuation",2007,"Ecological Economics","60","4",,"743","751",,50,"https://www.scopus.com/inward/record.uri?eid=2-s2.0-33846600437&doi=10.1016%2fj.ecolecon.2006.01.009&partnerID=40&md5=5f4b343006bdf226997ecedebb281506",Article,Scopus,2-s2.0-33846600437
"Caplan A., Grijalva T., Jackson-Smith D.","7202632063;6506945201;6602564318;","Using choice question formats to determine compensable values: The case of a landfill-siting process",2007,"Ecological Economics","60","4",,"834","846",,29,"https://www.scopus.com/inward/record.uri?eid=2-s2.0-33846642137&doi=10.1016%2fj.ecolecon.2006.02.015&partnerID=40&md5=4a85b2f33550892eba77cf12ffd473e2",Article,Scopus,2-s2.0-33846642137
"Scarpa R., Campbell D., Hutchinson W.G.","7101679887;56857858800;7006497149;","Benefit estimates for landscape improvements: Sequential Bayesian design and respondents' rationality in a choice experiment",2007,"Land Economics","83","4",,"617","634",,99,"https://www.scopus.com/inward/record.uri?eid=2-s2.0-34548234687&doi=10.3368%2fle.83.4.617&partnerID=40&md5=5f5099c5481b0c933a76575d0b2a3d61",Article,Scopus,2-s2.0-34548234687
"Alfnes F., Guttormsen A.G., Steine G., Kolstad K.","7801410199;7003457009;15021188000;7003649252;","Consumers' willingness to pay for the color of salmon: A choice experiment with real economic incentives",2006,"American Journal of Agricultural Economics","88","4",,"1050","1061",,151,"https://www.scopus.com/inward/record.uri?eid=2-s2.0-33750046331&doi=10.1111%2fj.1467-8276.2006.00915.x&partnerID=40&md5=9e7e469c018549dd6040d7e634478804",Article,Scopus,2-s2.0-33750046331
"Birol E., Karousakis K., Koundouri P.","14059648600;14060300000;14060612200;","Using a choice experiment to account for preference heterogeneity in wetland attributes: The case of Cheimaditida wetland in Greece",2006,"Ecological Economics","60","1",,"145","156",,214,"https://www.scopus.com/inward/record.uri?eid=2-s2.0-33749626273&doi=10.1016%2fj.ecolecon.2006.06.002&partnerID=40&md5=4ef8e4a6cfedb592bd1b38db8eb1a147",Article,Scopus,2-s2.0-33749626273
"Sælensminde K.","6602489565;","Causes and consequences of lexicographic choices in stated choice studies",2006,"Ecological Economics","59","3",,"331","340",,28,"https://www.scopus.com/inward/record.uri?eid=2-s2.0-33748102631&doi=10.1016%2fj.ecolecon.2005.11.001&partnerID=40&md5=53f02a0f17297715ad97c72a0e852ec1",Article,Scopus,2-s2.0-33748102631
"Colombo S., Calatrava-Requena J., Hanley N.","56268441100;8317958300;7005750378;","Analysing the social benefits of soil conservation measures using stated preference methods",2006,"Ecological Economics","58","4",,"850","861",,55,"https://www.scopus.com/inward/record.uri?eid=2-s2.0-33744525816&doi=10.1016%2fj.ecolecon.2005.09.010&partnerID=40&md5=54aafc91cd3e8f04bb53eff4555fb1b3",Article,Scopus,2-s2.0-33744525816
"Christie M., Hanley N., Warren J., Murphy K., Wright R., Hyde T.","7102359765;7005750378;7402212691;7402864036;7403912271;13609090100;","Valuing the diversity of biodiversity",2006,"Ecological Economics","58","2",,"304","317",,196,"https://www.scopus.com/inward/record.uri?eid=2-s2.0-33646782571&doi=10.1016%2fj.ecolecon.2005.07.034&partnerID=40&md5=9b2dde2752b106141a722e1fd5c82ea8",Article,Scopus,2-s2.0-33646782571
"Jin J., Wang Z., Ran S.","57199207196;7410049335;13103647500;","Comparison of contingent valuation and choice experiment in solid waste management programs in Macao",2006,"Ecological Economics","57","3",,"430","441",,55,"https://www.scopus.com/inward/record.uri?eid=2-s2.0-33646132736&doi=10.1016%2fj.ecolecon.2005.04.020&partnerID=40&md5=8a967ff34ca9fbb49c1456c60a95111b",Article,Scopus,2-s2.0-33646132736
"Louviere J.J.","7004145149;","What you don't know might hurt you: Some unresolved issues in the design and analysis of discrete choice experiments",2006,"Environmental and Resource Economics","34","1",,"173","188",,59,"https://www.scopus.com/inward/record.uri?eid=2-s2.0-33645549260&doi=10.1007%2fs10640-005-4817-0&partnerID=40&md5=46a04e9ab50c5ee032ac24f7205f05ae",Article,Scopus,2-s2.0-33645549260
"Norwood F.B., Henneberry S.R.","8705689600;6602789118;","Show me the money! The value of college graduate attributes as expressed by employers and perceived by students",2006,"American Journal of Agricultural Economics","88","2",,"484","498",,10,"https://www.scopus.com/inward/record.uri?eid=2-s2.0-33645729840&doi=10.1111%2fj.1467-8276.2006.00873.x&partnerID=40&md5=7216e564e2889b2118d625d3a2955627",Article,Scopus,2-s2.0-33645729840
"Álvarez-Farizo B., Hanley N.","6506098810;7005750378;","Improving the process of valuing non-market benefits: Combining citizen's juries with choice modelling",2006,"Land Economics","82","3",,"465","478",,56,"https://www.scopus.com/inward/record.uri?eid=2-s2.0-33747028811&doi=10.3368%2fle.82.3.465&partnerID=40&md5=57457042c1f2395b3f9c30e5e349c811",Article,Scopus,2-s2.0-33747028811
"Hensher D., Shore N., Train K.","7006695697;9739636900;7003665729;","Households' willingness to pay for water service attributes",2005,"Environmental and Resource Economics","32","4",,"509","531",,111,"https://www.scopus.com/inward/record.uri?eid=2-s2.0-28544433114&doi=10.1007%2fs10640-005-7686-7&partnerID=40&md5=2cd4e0d9b99f707b198d54f149c5c25f",Article,Scopus,2-s2.0-28544433114
